Name,Description,Latitude,Longitude,InfoURL,ImageURL
UCSB,A great university located along the California coast!,34.416929,-119.845991,"https://en.wikipedia.org/wiki/University_of_California,_Santa_Barbara",https://www.history.ucsb.edu/wp-content/uploads/LagoonFall20141.jpg
Antelope Canyon,"The most photographed Slot Canyon in the world.The most famous section of Antelope Canyon is Upper Antelope Canyon. A mere 100 yards in length, it sees hundreds of thousands of tourists a year, yet represents only a small section of Antelope Canyon. Its longer counterpart, Lower Antelope Canyon, sees slightly less people due to its physical challenges, but has become just as popular as Upper Antelope Canyon in recent years.",36.86191,-111.37433,https://antelopecanyon.az/,https://upload.wikimedia.org/wikipedia/commons/3/32/Lower_Antelope_Canyon_478.jpg
Las Vegas,"Las Vegas is an internationally renowned major resort city, known primarily for its gambling, shopping, fine dining, entertainment, and nightlife. The Las Vegas Valley as a whole serves as the leading financial, commercial, and cultural center for Nevada.",36.169941,-115.13983,https://en.wikipedia.org/wiki/Las_Vegas,https://2traveldads.com/wp-content/uploads/2018/04/Las-Vegas-Strip-from-Cosmopolitan-Hotel-2DadsWithBaggage-1.jpg
Arroyo Hondo Preserve,"Called the “Jewel of the Gaviota Coast,” the 782-acre Arroyo Hondo Preserve is a magnificent canyon located west of Santa Barbara between Refugio State Beach and Gaviota State Park.",34.476027,-120.137558,https://www.sblandtrust.org/portfolio-item/arroyo-hondo-preserve/,https://www.syvnature.org/wp-content/uploads/2018/08/Arroyo-Hondo-sycamores-John-Evarts.jpg
Skydive  Santa  Barbara,SSB is the ideal skydive center for first time jumpers and Southern CA's only dropzone offering 18000ft jumps!,34.667991,-120.458209,https://www.skydivesantabarbara.com/,https://2.bp.blogspot.com/-ZUc5TMqWaT0/WZg3hd5FdiI/AAAAAAAAGlI/8hg5Ak5EZA88-JjlEQKjMd77lCXC5UO8gCLcBGAs/s1600/2017-08-19_190158.jpg
Huntington  Library,"The Huntington Library, Art Collections, and Botanical Gardens.1151 Oxford Road San Marino, CA 91108",34.129045,-118.114524,https://www.huntington.org/,https://travelswithmaitaitom.com/wp-content/uploads/2019/04/Huntington-Library-Art-Collections-and-Botanical-Gardens-Travels-With-Mai-Tai-Tom-1-2.jpg
